716,716,https://www.coursera.org/learn/ciudades-politicas-urbanas,Free,Universitat Autònoma de Barcelona,Ciudades en crisis y nuevas políticas urbanas,"Entrepreneurship, Business Psychology, Leadership and Management, Organizational Development, Research and Design, Business Analysis, Computer Graphics, Computer Networking, Critical Thinking, Human Computer Interaction, Innovation, Interactive Design, Network Architecture, Planning, Strategy and Operations, Supply Chain and Logistics",4.7,(222 reviews),Beginner · Course · 1-3 Months,Ciudades en crisis nuevas polticas urbanas
717,717,https://www.coursera.org/learn/discrete-mathematics-ch,Free,Shanghai Jiao Tong University,离散数学,,4.4,(28 reviews),Beginner · Course · 1-3 Months,
718,718,https://www.coursera.org/learn/assessment-higher-education,Free,Erasmus University Rotterdam,Assessment in Higher Education: Professional Development for Teachers,"ArcGIS, Business Analysis, Critical Thinking, Leadership and Management, Professional Development, Research and Design, Statistical Programming, Strategy and Operations",4.8,(317 reviews),Intermediate · Course · 1-3 Months,Assessment Higher Education Professional Development Teachers
719,719,https://www.coursera.org/learn/doing-economics-measuring-climate-change,Free,University of London,Doing Economics: Measuring Climate Change,"Big Data, Data Analysis, Data Management, Data Visualization, Entrepreneurship, Leadership and Management, Marketing, Sales, Strategy, Strategy and Operations, Computer Programming, Experiment, Microsoft Excel, Probability & Statistics, R Programming, Statistical Programming",4.6,(17 reviews),Beginner · Course · 1-4 Weeks,Economics Measuring Climate Change
720,720,https://www.coursera.org/learn/analyzing-visualizing-data-google-way,Free,Google Cloud,Analyzing and Visualizing Data the Google Way,"Data Management, Computer Architecture, Computer Programming, Data Analysis, Databases, Distributed Computing Architecture, Full-Stack Web Development, Python Programming, R Programming, SQL, Statistical Programming, Web Development",,,Beginner · Course · 1-4 Weeks,Analyzing Visualizing Data Google Way
721,721,https://www.coursera.org/learn/introduction-to-applied-cryptography,Free,University of London,Introduction to Applied Cryptography,"Cryptography, Security Engineering, Theoretical Computer Science",,,Beginner · Course · 1-4 Weeks,Introduction Applied Cryptography
722,722,https://www.coursera.org/learn/interactive-media-gaming,Free,Vanderbilt University,"Online Games: Literature, New Media, and Narrative","Communication, Storytelling, Game Theory, Mathematics, Business Psychology, Culture, Leadership and Management, Research and Design, Business Analysis, Creativity, Critical Thinking, Entrepreneurship, Strategy and Operations",4.6,(170 reviews),Beginner · Course · 1-3 Months,Online Games Literature New Media Narrative
723,723,https://www.coursera.org/learn/material-science-engineering,Free,Georgia Institute of Technology,Material Processing,"Data Visualization, Material Handling, Statistical Visualization, Supply Chain and Logistics",4.8,(983 reviews),Mixed · Course · 1-4 Weeks,Material Processing
724,724,https://www.coursera.org/learn/new-nordic-diet,Free,University of Copenhagen,The New Nordic Diet - from Gastronomy to Health,,4.6,(723 reviews),Mixed · Course · 1-3 Months,New Nordic Diet  Gastronomy Health
725,725,https://www.coursera.org/learn/ue-historia-instituciones-politicas,Free,Universitat Autònoma de Barcelona,"Unión Europea: Historia, Instituciones y Políticas",,4.6,(86 reviews),Beginner · Course · 1-3 Months,Unin Europea Historia Instituciones Polticas
726,726,https://www.coursera.org/learn/non-communicable-diseases-in-humanitarian-settings,Free,University of Copenhagen,Non-Communicable Diseases in Humanitarian Settings,"Entrepreneurship, Epidemiology, Probability & Statistics, Leadership and Management, Market Research, Computer Graphics, Graphics Software, Training",4.8,(92 reviews),Intermediate · Course · 1-4 Weeks,NonCommunicable Diseases Humanitarian Settings
727,727,https://www.coursera.org/learn/linux-on-linuxone,Free,IBM,Linux on LinuxONE,,4.7,(6 reviews),Beginner · Course · 1-3 Months,Linux LinuxONE
728,728,https://www.coursera.org/learn/algae-biotechnology,Free,University of California San Diego,Algae Biotechnology,"Finance, Regulations and Compliance",4.8,(408 reviews),Intermediate · Course · 1-3 Months,Algae Biotechnology
729,729,https://www.coursera.org/learn/air-pollution-health-threat,Free,University of Copenhagen,Air Pollution – a Global Threat to our Health,,4.8,(1.4k reviews),Beginner · Course · 1-4 Weeks,Air Pollution  Global Threat Health
730,730,https://www.coursera.org/learn/discrete-calculus,Free,University of Pennsylvania,Single Variable Calculus,"Calculus, Mathematics, Mathematical Theory & Analysis, Graph Theory",4.6,(295 reviews),Mixed · Course · 1-3 Months,Single Variable Calculus
731,731,https://www.coursera.org/learn/international-travel,Free,Johns Hopkins University,"International Travel Preparation, Safety, & Wellness","Leadership and Management, Business Psychology, Communication, Culture, Entrepreneurship, Planning, Supply Chain and Logistics",4.7,(379 reviews),Beginner · Course · 1-4 Weeks,International Travel Preparation Safety  Wellness
732,732,https://www.coursera.org/projects/analyze-company-performance-ratios,,Coursera Project Network,Analyzing Company Performance using Ratios,"Accounting, Business Analysis, Data Analysis, Financial Analysis, Finance",4.2,(757 reviews),Intermediate · Guided Project · Less Than 2 Hours,Analyzing Company Performance Ratios
733,733,https://www.coursera.org/learn/project-planning-es,Free,"University of California, Irvine",Inicio y planificación de proyectos,"Leadership and Management, Project Management, Strategy and Operations, Conflict Management, Human Resources, Sales, Strategy",4.8,(115 reviews),Mixed · Course · 1-3 Months,Inicio planificacin de proyectos
734,734,https://www.coursera.org/learn/communicate-with-impact-fr,Free,Macquarie University,Storytelling et influence : Communiquer pour convaincre,"Communication, Influencing, Marketing, Leadership and Management, Conflict Management, Human Resources, Negotiation, Sales, Social Media, Storytelling",4.7,(37 reviews),Mixed · Course · 1-3 Months,Storytelling et influence  Communiquer pour convaincre
735,735,https://www.coursera.org/learn/excel-essentials-de,Free,Macquarie University,Excel-Kenntnisse für Unternehmen: Grundlagen,"Data Analysis, Microsoft Excel",,,Beginner · Course · 1-3 Months,ExcelKenntnisse fr Unternehmen Grundlagen
736,736,https://www.coursera.org/learn/manejo-del-estres-en-los-colaboradores,Free,Tecnológico de Monterrey,Manejo del estrés en los colaboradores,,,,Advanced · Course · 1-4 Weeks,Manejo del estrs en los colaboradores
737,737,https://www.coursera.org/learn/geotermia,Free,Universidad Nacional Autónoma de México,Introducción a la geotermia,,4.9,(617 reviews),Beginner · Course · 1-3 Months,Introduccin la geotermia
738,738,https://www.coursera.org/projects/use-canva-to-create-desktop-and-mobile-friendly-webpages,,Coursera Project Network,Use Canva to Create Desktop and Mobile-friendly Web Pages.,"Communication, Computer Graphics, Graphic Design, Marketing, Research and Design, Social Media, Visual Design, Web Design, Web Development, Business, Computer Programming",4.6,(814 reviews),Beginner · Guided Project · Less Than 2 Hours,Use Canva Create Desktop Mobilefriendly Web Pages
739,739,https://www.coursera.org/learn/representaciones-culturales,Free,Universitat Autònoma de Barcelona,Representaciones culturales de las sexualidades,"Business Psychology, Culture, Leadership and Management",4.8,(615 reviews),Beginner · Course · 1-3 Months,Representaciones culturales de las sexualidades
740,740,https://www.coursera.org/learn/negotiation-skills-de,Free,University of Michigan,Erfolgreich Verhandeln: Strategien und Fähigkeiten,,,,Mixed · Course · 1-3 Months,Erfolgreich Verhandeln Strategien und Fhigkeiten
741,741,https://www.coursera.org/projects/create-charts-dashboards-using-microsoft-excel,,Coursera Project Network,Create Charts and Dashboards Using Microsoft Excel,"Business Analysis, Data Analysis, Data Analysis Software, Data Visualization, Microsoft Excel, Spreadsheet Software",4.6,(284 reviews),Intermediate · Guided Project · Less Than 2 Hours,Create Charts Dashboards Microsoft Excel
742,742,https://www.coursera.org/projects/create-project-management-tracker-microsoft-excel,,Coursera Project Network,Create a Project Management Tracker using Microsoft Excel,"Business Analysis, Data Analysis, Data Analysis Software, Leadership and Management, Microsoft Excel, Project Management, Spreadsheet Software, Strategy and Operations, Entrepreneurship",4.7,(217 reviews),Beginner · Guided Project · Less Than 2 Hours,Create Project Management Tracker Microsoft Excel
743,743,https://www.coursera.org/learn/business-implications-ai-nano-course,Free,EIT Digital,Business Implications of AI: A Nano-course,"Strategy and Operations, Sales, Business Development, Data Analysis, Entrepreneurship, Leadership and Management, Marketing, Strategy, Applied Machine Learning, Big Data, Data Management, Machine Learning",4.5,(105 reviews),Beginner · Course · 1-4 Weeks,Business Implications AI Nanocourse
744,744,https://www.coursera.org/learn/fia-gestao-clubes-federacoes-esportivas,Free,Fundação Instituto de Administração,A prática da gestão de clubes e federações esportivas,"Marketing, Communication, Entrepreneurship, Leadership and Management, Finance, Financial Management, Planning, Sales, Supply Chain and Logistics",4.8,(263 reviews),Beginner · Course · 1-3 Months,prtica da gesto de clubes e federaes esportivas
745,745,https://www.coursera.org/projects/getting-started-in-google-analytics,,Coursera Project Network,Getting Started in Google Analytics,"Data Analysis, Data Analysis Software, Back-End Web Development, Data Management, Financial Analysis, Search Engine Optimization, Web Development",4.4,(1.4k reviews),Beginner · Guided Project · Less Than 2 Hours,Getting Started Google Analytics
746,746,https://www.coursera.org/learn/pensamiento-sistemico,Free,Universidad Nacional Autónoma de México,Pensamiento sistémico,"Entrepreneurship, Business Psychology, Human Learning, Leadership and Management, Operating Systems, Problem Solving, Research and Design, Systems Design, Theoretical Computer Science",4.7,(1.2k reviews),Mixed · Course · 1-4 Weeks,Pensamiento sistmico
747,747,https://www.coursera.org/learn/image-processing,Free,Duke University,Image and Video Processing: From Mars to Hollywood with a Stop at the Hospital,"Computer Graphic Techniques, Computer Graphics, Applied Mathematics, Computer Vision, Machine Learning, Linear Algebra, Calculus, Differential Equations, Geometry",4.7,(1.1k reviews),Mixed · Course · 1-3 Months,Image Video Processing Mars Hollywood Stop Hospital
748,748,https://www.coursera.org/learn/self-reflection-meditation,Free,Korea Advanced Institute of Science and Technology(KAIST),Meditation: A way to achieve your goals in your life,,4.6,(960 reviews),Beginner · Course · 1-3 Months,Meditation way achieve goals life
749,749,https://www.coursera.org/learn/gobiernos-locales,Free,Universidad Nacional Autónoma de México,Los gobiernos locales como actores internacionales,"Communication, Entrepreneurship, Leadership and Management, Business Psychology, Marketing, Advertising, Business Communication, Collaboration, Culture, Forecasting, General Statistics, Organizational Development, Probability & Statistics, Public Relations, Regression, Sales, Strategy, Strategy and Operations",4.8,(874 reviews),Intermediate · Course · 1-3 Months,Los gobiernos locales como actores internacionales
750,750,https://www.coursera.org/learn/finanzas-corporativas,Free,Universidad Austral,Finanzas Corporativas,"Finance, Accounting, Business Analysis, Data Analysis, Financial Analysis, Financial Management, Leadership and Management",4.7,(352 reviews),Beginner · Course · 1-4 Weeks,Finanzas Corporativas
751,751,https://www.coursera.org/learn/israel,Free,Hebrew University of Jerusalem,Israel State and Society,"Business Psychology, Culture, Leadership and Management, Entrepreneurship, Adaptability, Applied Machine Learning, Econometrics, General Statistics, Machine Learning, Market Research, Probability & Statistics, Reinforcement Learning, Research and Design",4.7,(336 reviews),Beginner · Course · 3-6 Months,Israel State Society
752,752,https://www.coursera.org/learn/sistemas-y-modelos-de-organizacion-de-la-atencion-en-salud,Free,Pontificia Universidad Católica de Chile,Sistemas y modelos de organización de la atención en salud,,,,Beginner · Course · 1-4 Weeks,Sistemas modelos de organizacin de la atencin en salud
753,753,https://www.coursera.org/learn/como-persuadir,Free,Universitat Autònoma de Barcelona,"¿Cómo persuadir? Jugando con palabras, imágenes y números","Communication, Research and Design, Strategy and Operations",4.4,(3k reviews),Beginner · Course · 1-3 Months,Cmo persuadir Jugando con palabras imgenes nmeros
754,754,https://www.coursera.org/learn/inversiones-en-cripto,Free,Universidad Austral,Cómo Invertir en Cripto,"Finance, BlockChain, Cryptography, FinTech, Security Engineering, Theoretical Computer Science, Investment Management",4.8,(71 reviews),Beginner · Course · 1-3 Months,Cmo Invertir en Cripto
755,755,https://www.coursera.org/learn/sustainability-social-ecological-systems,Free,Universitat Autònoma de Barcelona,"Sustainability of Social-Ecological Systems: the Nexus between Water, Energy and Food","Leadership and Management, Data Analysis, Entrepreneurship, Research and Design, Applied Machine Learning, ArcGIS, Biostatistics, Business Analysis, Business Psychology, Critical Thinking, Machine Learning, Market Research, Organizational Development, Planning, Probability & Statistics, Problem Solving, Statistical Machine Learning, Statistical Programming, Strategy and Operations",4.5,(76 reviews),Intermediate · Course · 1-3 Months,Sustainability SocialEcological Systems Nexus Water Energy Food
756,756,https://www.coursera.org/learn/god-korean-context,Free,Yonsei University,Re-imaging God in Korean Context,"Business Psychology, Culture, Leadership and Management",4.8,(85 reviews),Beginner · Course · 1-3 Months,Reimaging God Korean Context
757,757,https://www.coursera.org/learn/fire-effect,Free,"University of Maryland, College Park","The Effect of Fires on People, Property and the Environment","Finance, Risk Management",4.7,(473 reviews),Mixed · Course · 1-3 Months,Effect Fires People Property Environment
758,758,https://www.coursera.org/learn/feedingtheworld,Free,University of Pennsylvania,Feeding the World,"Leadership and Management, Accounting, Advertising, Audit, Communication, Marketing",4.7,(203 reviews),Beginner · Course · 1-3 Months,Feeding World
759,759,https://www.coursera.org/learn/erasmus-philosophy-skepticism,Free,Erasmus University Rotterdam,The Politics of Skepticism,"Business Analysis, Critical Thinking, Leadership and Management, Research and Design, Strategy and Operations",4.4,(36 reviews),Intermediate · Course · 1-3 Months,Politics Skepticism
760,760,https://www.coursera.org/learn/digital-democracy,Free,University of Michigan,Securing Digital Democracy,"Security Engineering, Operating Systems, Software Security, System Security, Human Computer Interaction, Human Factors (Security), Security Strategy, Computer Security Incident Management, Cyberattacks, Network Security",4.8,(158 reviews),Mixed · Course · 1-3 Months,Securing Digital Democracy
761,761,https://www.coursera.org/learn/sql-data-science-pt,Free,IBM Skills Network,Bancos de dados e SQL para Ciência de Dados,"Data Management, Databases, SQL, Statistical Programming, Computer Programming, Python Programming",4.5,(118 reviews),Beginner · Course · 1-4 Weeks,Bancos de dados e SQL para Cincia de Dados
762,762,https://www.coursera.org/learn/programming-languages-part-b,Free,University of Washington,"Programming Languages, Part B","Computer Programming, Computer Science, Other Programming Languages, Computational Logic, Computer Programming Tools, Mathematical Theory & Analysis, Mathematics, Programming Principles, Theoretical Computer Science",4.9,(712 reviews),Intermediate · Course · 1-4 Weeks,Programming Languages B
763,763,https://www.coursera.org/learn/electrones-en-accion,Free,Pontificia Universidad Católica de Chile,Electrones en Acción: Electrónica y Arduinos para tus propios Inventos,"Virtual Reality, Computer Programming, Computer Architecture, Computer Graphics, Computer Networking, Human Computer Interaction, Interactive Design, Internet Of Things, Network Architecture, Software Engineering, Computational Logic, Theoretical Computer Science, Algorithms, Mathematics",4.8,(2.4k reviews),Mixed · Course · 1-4 Weeks,Electrones en Accin Electrnica Arduinos para tus propios Inventos
764,764,https://www.coursera.org/learn/cuidados-del-recien-nacido,Free,Universidad de Chile,Cuidados y procedimientos generales en la atención del recién nacido,,4.8,(1.8k reviews),Intermediate · Course · 1-3 Months,Cuidados procedimientos generales en la atencin del recin nacido
765,765,https://www.coursera.org/learn/ciencia-computacao-python-conceitos-2,Free,Universidade de São Paulo,Introdução à Ciência da Computação com Python Parte 2,"Computer Programming, Python Programming, Statistical Programming, Communication, Theoretical Computer Science, Algorithms, Software Engineering, Computational Logic, Programming Principles, Software Testing, Data Management, Data Structures",4.9,(1.4k reviews),Beginner · Course · 1-3 Months,Introduo  Cincia da Computao com Python Parte 2
766,766,https://www.coursera.org/learn/controle,Free,Instituto Tecnológico de Aeronáutica,Introdução ao Controle de Sistemas,"Mathematics, Mathematical Theory & Analysis, Operating Systems, Applied Mathematics, Calculus, Computer Networking, Network Model",4.9,(1.1k reviews),Mixed · Course · 1-4 Weeks,Introduo ao Controle de Sistemas
767,767,https://www.coursera.org/learn/experimentation,Free,McMaster University,Experimentation for Improvement,"Computer Programming, Experiment, Probability & Statistics, R Programming, Statistical Programming, Data Analysis, Business Analysis, Statistical Analysis",4.8,(889 reviews),Intermediate · Course · 1-3 Months,Experimentation Improvement
768,768,https://www.coursera.org/learn/marketing-analitico,Free,Insper,Introdução ao Marketing Analítico,"Accounting, Business Analysis, Data Analysis, Financial Analysis, Market Analysis, Marketing, Data Management, Entrepreneurship, Correlation And Dependence, Econometrics, General Statistics, Market Research, Probability & Statistics, Regression, Research and Design",4.7,(769 reviews),Mixed · Course · 1-3 Months,Introduo ao Marketing Analtico
769,769,https://www.coursera.org/learn/conceptos-estudio-del-medio-ambiente,Free,Universidad Austral,Conceptos base para el estudio del medio ambiente,"Biostatistics, Business Analysis, Data Analysis, Probability & Statistics, Probability Distribution, Statistical Analysis",4.6,(462 reviews),Beginner · Course · 1-4 Weeks,Conceptos base para el estudio del medio ambiente
770,770,https://www.coursera.org/learn/ingenieria-trafico,Free,Pontificia Universidad Católica de Chile,Ingeniería de Tráfico,"Mathematics, Applied Mathematics, Basic Descriptive Statistics, Calculus, Data Analysis, Graph Theory, Operations Management, Probability & Statistics, Project Management, Strategy and Operations",4.8,(348 reviews),Beginner · Course · 1-4 Weeks,Ingeniera de Trfico
771,771,https://www.coursera.org/learn/demanda-de-transporte,Free,Pontificia Universidad Católica de Chile,Introducción a los modelos de demanda de transporte,"Supply Chain and Logistics, Transportation Operations Management, Operations Management, Probability & Statistics, Strategy and Operations, Business Analysis, Data Analysis, Data Management, Data Model, Mathematics, Probability Distribution, Statistical Analysis, Supply Chain Systems",4.7,(408 reviews),Intermediate · Course · 1-3 Months,Introduccin los modelos de demanda de transporte
772,772,https://www.coursera.org/learn/lab-poo-parte-2,Free,Universidade de São Paulo,Laboratório de Programação Orientada a Objetos - Parte 2,"Computer Programming, Operating Systems, Software Framework, System Programming, Programming Principles, Software Architecture, Software Engineering, Theoretical Computer Science",5.0,(9 reviews),Advanced · Course · 1-3 Months,Laboratrio de Programao Orientada Objetos  Parte 2
773,773,https://www.coursera.org/learn/como-engajar-equipes-e-criar-cultura-em-ambientes-virtuais,Free,Fundação Instituto de Administração,Como engajar equipes e criar cultura em ambientes virtuais,"Business Psychology, Culture, Leadership and Management, Entrepreneurship, Human Resources, Marketing, Sales, Strategy, Strategy and Operations, Storytelling",4.9,(29 reviews),Beginner · Course · 1-4 Weeks,Como engajar equipes e criar cultura em ambientes virtuais
774,774,https://www.coursera.org/learn/pds,Free,Universidade Estadual de Campinas,Processamento Digital de Sinais - Amostragem,"Algorithms, General Statistics, Probability & Statistics, Theoretical Computer Science, Data Analysis, Data Analysis Software, Mathematics, Matlab",4.7,(195 reviews),Mixed · Course · 1-3 Months,Processamento Digital de Sinais  Amostragem
775,775,https://www.coursera.org/learn/writing-your-world,Free,University of Cape Town,Writing your World: Finding yourself in the academic space,"Business Analysis, Communication, Critical Thinking, Research and Design, Strategy and Operations, Writing",4.7,(212 reviews),Beginner · Course · 1-4 Weeks,Writing World Finding academic space
776,776,https://www.coursera.org/learn/emprendimiento-social-negocios-sustentable-canvas-sociales,Free,Pontificia Universidad Católica de Chile,Diseño y Creación de un Emprendimiento Social,"Sales, Entrepreneurship, Research and Design, Innovation, Communication",4.9,(907 reviews),Beginner · Course · 1-4 Weeks,Diseo Creacin de un Emprendimiento Social
777,777,https://www.coursera.org/learn/modeling-simulation-natural-processes,Free,University of Geneva,Simulation and modeling of natural processes,"Computer Programming, Python Programming, Statistical Programming, Mathematics, Mathematical Theory & Analysis, Operations Research, Research and Design, Strategy and Operations, Artificial Neural Networks, Computational Thinking, Deep Learning, Differential Equations, Machine Learning, Algebra, Algorithms, Other Programming Languages, Probability & Statistics, Theoretical Computer Science, Computer Graphic Techniques, Computer Graphics, Software Architecture, Software Engineering",4.2,(341 reviews),Mixed · Course · 1-3 Months,Simulation modeling natural processes
778,778,https://www.coursera.org/learn/zhenge-beida-zaixian-chuangye,Free,Peking University,真格—北大在线创业课堂,"Leadership and Management, Business Psychology, Entrepreneurship, Human Resources, Marketing, Brand Management, Change Management, Culture, Finance, HR Tech, People Development, Regulations and Compliance, Sales, Strategy and Operations",4.7,(155 reviews),Mixed · Course · 1-4 Weeks,
779,779,https://www.coursera.org/learn/reproductive-health,Free,Northwestern University,Introduction to Reproduction,,4.7,(492 reviews),Mixed · Course · 1-4 Weeks,Introduction Reproduction
780,780,https://www.coursera.org/learn/python-data-processing,Free,Nanjing University,Data Processing Using Python,"Computer Programming, Python Programming, Computer Science, Data Structures, Theoretical Computer Science, Computational Thinking, Human Computer Interaction, User Experience, Statistical Programming",4.1,(307 reviews),Beginner · Course · 1-3 Months,Data Processing Python
781,781,https://www.coursera.org/learn/project-management-basics-ar,Free,"University of California, Irvine",إدارة المشروع: أساسيات النجاح,"Project Management, Strategy and Operations, Entrepreneurship, Leadership and Management, Marketing, Sales, Strategy",5.0,(16 reviews),Mixed · Course · 1-4 Weeks,   
782,782,https://www.coursera.org/learn/da-xue-hua-xue,Free,Peking University,大学化学,"Graph Theory, Mathematics",4.9,(129 reviews),Mixed · Course · 1-3 Months,
783,783,https://www.coursera.org/projects/create-design-digital-products-canva,,Coursera Project Network,Create and Design Digital Products using Canva,"Computer Graphics, Design and Product, Graphic Design, Marketing",4.5,(532 reviews),Advanced · Guided Project · Less Than 2 Hours,Create Design Digital Products Canva
784,784,https://www.coursera.org/learn/sdn,Free,The University of Chicago,Software Defined Networking,"Computer Networking, Information Technology, Software-Defined Networking, Computer Architecture, Network Architecture",4.6,(254 reviews),Mixed · Course · 1-3 Months,Software Defined Networking
785,785,https://www.coursera.org/projects/preparation-for-job-interviews,,Coursera Project Network,Preparation for Job Interviews,"Entrepreneurship, Market Research, Research and Design, Communication",4.5,(483 reviews),Beginner · Guided Project · Less Than 2 Hours,Preparation Job Interviews
786,786,https://www.coursera.org/projects/get-started-figma,,Coursera Project Network,Get Started with Figma,"Business Psychology, Human Computer Interaction, Research and Design, User Experience, Web Design, Web Development, Entrepreneurship",4.2,(302 reviews),Beginner · Guided Project · Less Than 2 Hours,Started Figma
