216,216,https://www.coursera.org/learn/systems-thinking,Free,Johns Hopkins University,Systems Thinking In Public Health,"Entrepreneurship, Problem Solving, Research and Design, Strategy and Operations, Business Analysis, Critical Thinking, Decision Making, Operations Research, Project Management",4.6,(846 reviews),Mixed · Course · 1-4 Weeks,Systems Thinking Public Health
217,217,https://www.coursera.org/learn/ecology-conservation,Free,American Museum of Natural History,Ecology: Ecosystem Dynamics and Conservation,"Entrepreneurship, Business Psychology, General Statistics, Leadership and Management, Probability & Statistics, Problem Solving, Research and Design, Resilience",4.8,(3k reviews),Intermediate · Course · 1-3 Months,Ecology Ecosystem Dynamics Conservation
218,218,https://www.coursera.org/learn/global-environmental-management,Free,Technical University of Denmark (DTU),Global Environmental Management,"Leadership and Management, Entrepreneurship, Market Research, Planning, Research and Design, Supply Chain and Logistics",4.7,(1.9k reviews),Intermediate · Course · 1-3 Months,Global Environmental Management
219,219,https://www.coursera.org/learn/cybersecurity-in-healthcare,Free,Erasmus University Rotterdam,Cybersecurity in Healthcare (Hospitals & Care Centres),"Security Engineering, Cyberattacks, System Security, Human Computer Interaction, Human Factors (Security), Leadership and Management, Security Strategy, Business Psychology, Communication, Culture, Finance, Marketing, Regulations and Compliance, Social Media, Software Security",4.6,(197 reviews),Beginner · Course · 1-3 Months,Cybersecurity Healthcare Hospitals  Care Centres
220,220,https://www.coursera.org/learn/nutricion-obesidad-sobrepeso,Free,Universidad Nacional Autónoma de México,Nutrición y obesidad: control de sobrepeso,,4.8,(5.2k reviews),Beginner · Course · 1-4 Weeks,Nutricin obesidad control de sobrepeso
221,221,https://www.coursera.org/learn/interactive-teaching,Free,The University of Tokyo,Interactive Teaching（インタラクティブ・ティーチング）,"Leadership and Management, Business Psychology, Entrepreneurship, Human Learning, Human Resources, People Development, Applied Machine Learning, Change Management, Machine Learning, Strategy and Operations",4.7,(23 reviews),Mixed · Course · 1-3 Months,Interactive Teaching
222,222,https://www.coursera.org/learn/new-technologies-business-leaders,Free,Rutgers the State University of New Jersey,New Technologies for Business Leaders,"Change Management, Leadership and Management, Strategy and Operations, Business Analysis, Business Transformation, Entrepreneurship, Innovation, Research and Design, Digital Marketing, Marketing, Professional Development, Applied Machine Learning, Artificial Neural Networks, Big Data, BlockChain, Data Management, FinTech, Finance, Internet Of Things, Machine Learning, Computer Architecture, Computer Graphics, Computer Networking, Computer Vision, Human Computer Interaction, Interactive Design, Network Architecture, Sales, Software Engineering, Strategy, User Experience, Virtual Reality",4.4,(356 reviews),Intermediate · Course · 1-3 Months,New Technologies Business Leaders
223,223,https://www.coursera.org/learn/cyber-conflicts,Free,The State University of New York,International Cyber Conflicts,"Computer Networking, Computer Security Incident Management, Computer Security Models, Cyberattacks, Information Technology, Network Model, Entrepreneurship, Leadership and Management, Marketing, Sales, Security Engineering, Strategy, Strategy and Operations",4.5,(1.4k reviews),Mixed · Course · 1-3 Months,International Cyber Conflicts
224,224,https://www.coursera.org/learn/problem-solving-programming-video-games,Free,University of Alberta,"Problem Solving, Python Programming, and Video Games","Computer Programming, Python Programming, Statistical Programming, Leadership and Management, Entrepreneurship, Problem Solving, Research and Design, Computer Programming Tools, Software Engineering, Theoretical Computer Science, Application Development, Computational Logic, Computational Thinking, Design and Product, Product Design, Programming Principles, Machine Learning, Mathematical Theory & Analysis, Mathematics, Planning, Software Testing, Supply Chain and Logistics, Algorithms, Natural Language Processing, Computer Science",4.3,(197 reviews),Beginner · Course · 1-3 Months,Problem Solving Python Programming Video Games
225,225,https://www.coursera.org/learn/legaltech,Free,Universidad Austral,El Abogado del Futuro: Legaltech y la Transformación Digital del Derecho,"BlockChain, Entrepreneurship, Finance, Algorithms, FinTech, Innovation, Machine Learning, Machine Learning Algorithms, Research and Design, Theoretical Computer Science",4.9,(882 reviews),Beginner · Course · 1-3 Months,El Abogado del Futuro Legaltech la Transformacin Digital del Derecho
226,226,https://www.coursera.org/learn/aprendiendo-a-aprender,Free,Deep Teaching Solutions,Aprendiendo a aprender: Poderosas herramientas mentales con las que podrás dominar temas difíciles (Learning How to Learn),"Business Psychology, Entrepreneurship, Human Learning, Leadership and Management, Problem Solving, Research and Design, Professional Development",4.9,(10.1k reviews),Beginner · Course · 1-3 Months,Aprendiendo aprender Poderosas herramientas mentales con las que podrs dominar temas difciles Learning Learn
227,227,https://www.coursera.org/learn/introduction-to-medical-software,Free,Yale University,Introduction to Medical Software,"Software Engineering, Software Testing, Computational Thinking, Computer Programming, General Statistics, Java Programming, Probability & Statistics, Security Engineering, Security Strategy, Software Engineering Tools, Algorithms, Application Development, Bioinformatics, Biostatistics, Business Analysis, Business Psychology, Computational Logic, Computer Graphic Techniques, Computer Graphics, Computer Networking, Data Analysis, Deep Learning, Design and Product, DevOps, Entrepreneurship, Feature Engineering, Finance, Human Computer Interaction, Human Factors (Security), Leadership and Management, Machine Learning, Machine Learning Algorithms, Mathematical Theory & Analysis, Mathematics, Network Security, Probability Distribution, Product Design, Product Lifecycle, Regulations and Compliance, Research and Design, Risk Management, Software Architecture, Software Security, Statistical Analysis, Theoretical Computer Science, User Experience, User Experience Design, User Research",4.8,(62 reviews),Intermediate · Course · 3-6 Months,Introduction Medical Software
228,228,https://www.coursera.org/learn/automation-business-analyst,Free,UiPath,Automation Business Analyst,"Business Analysis, Process Analysis",,,Beginner · Course · 1-3 Months,Automation Business Analyst
229,229,https://www.coursera.org/learn/introclassicalmusic,Free,Yale University,Introduction to Classical Music,,4.9,(3.7k reviews),Mixed · Course · 1-3 Months,Introduction Classical Music
230,230,https://www.coursera.org/learn/eu-making-europe-work,Free,Universiteit Leiden,EU policy and implementation: making Europe work!,"Decision Making, Entrepreneurship, Leadership and Management, Business Psychology, Organizational Development, Computer Architecture, Computer Networking, Network Architecture, Game Theory, Mathematics",4.4,(161 reviews),Intermediate · Course · 1-3 Months,EU policy implementation making Europe work
231,231,https://www.coursera.org/learn/global-health-human-animal-ecosystem,Free,University of Geneva,Global Health at the Human-Animal-Ecosystem Interface,"Epidemiology, Probability & Statistics, Finance, Risk Management, Collaboration, Communication",4.7,(303 reviews),Intermediate · Course · 1-3 Months,Global Health HumanAnimalEcosystem Interface
232,232,https://www.coursera.org/learn/mentaliser,Free,University of Geneva,Mentaliser : de la théorie à l’intervention clinique,"Probability & Statistics, General Statistics, Epidemiology, Business Psychology",4.9,(119 reviews),Beginner · Course · 1-3 Months,Mentaliser  de la thorie  lintervention clinique
233,233,https://www.coursera.org/learn/egypt,Free,Universitat Autònoma de Barcelona,Egiptología (Egyptology),,4.9,(1.4k reviews),Beginner · Course · 1-3 Months,Egiptologa Egyptology
234,234,https://www.coursera.org/learn/statistical-inferences,Free,Eindhoven University of Technology,Improving your statistical inferences,"Probability & Statistics, Statistical Tests, General Statistics, R Programming, Statistical Programming, Bayesian Statistics, Data Analysis, Probability Distribution, Statistical Analysis, Bayesian Network, Business Analysis, Experiment, Machine Learning",4.9,(750 reviews),Intermediate · Course · 1-3 Months,Improving statistical inferences
235,235,https://www.coursera.org/learn/geopolitics-europe,Free,Sciences Po,Geopolitics of Europe,"General Statistics, Probability & Statistics, Data Visualization, Geostatistics, Leadership and Management",4.4,(608 reviews),Mixed · Course · 1-3 Months,Geopolitics Europe
236,236,https://www.coursera.org/learn/data-analytics-for-lean-six-sigma,Free,University of Amsterdam,Data Analytics for Lean Six Sigma,"Probability & Statistics, Data Visualization, General Statistics, Statistical Visualization, Data Analysis, Basic Descriptive Statistics, Correlation And Dependence, Statistical Tests, Probability Distribution, Regression, Statistical Analysis, Business Analysis, Business Psychology, Entrepreneurship, Experiment, Leadership and Management, Minitab, Operations Management, Organizational Development, Planning, Plot (Graphics), Statistical Programming, Strategy and Operations, Supply Chain and Logistics",4.8,(3k reviews),Beginner · Course · 1-3 Months,Data Analytics Lean Sigma
237,237,https://www.coursera.org/learn/ai-ethics,Free,Lund University,Artificial Intelligence: Ethics & Societal Challenges,,4.6,(36 reviews),Beginner · Course · 1-4 Weeks,Artificial Intelligence Ethics  Societal Challenges
238,238,https://www.coursera.org/learn/logic-introduction,Free,Stanford University,Introduction to Logic,"Mathematics, Computational Logic, Project Management, Strategy and Operations, Theoretical Computer Science",4.4,(614 reviews),Intermediate · Course · 1-3 Months,Introduction Logic
239,239,https://www.coursera.org/learn/breast-cancer-causes-prevention,Free,Yale University,Introduction to Breast Cancer,"Epidemiology, Probability & Statistics",4.9,(1.2k reviews),Mixed · Course · 1-3 Months,Introduction Breast Cancer
240,240,https://www.coursera.org/learn/youth-health,Free,The University of Melbourne,Global Adolescent Health,,4.8,(103 reviews),Beginner · Course · 1-3 Months,Global Adolescent Health
241,241,https://www.coursera.org/learn/social-economic-networks,Free,Stanford University,Social and Economic Networks:  Models and Analysis,"Computer Networking, Mathematics, Network Analysis, Network Model, Graph Theory, Accounting, Epidemiology, Game Theory, Human Resources, Probability & Statistics",4.8,(698 reviews),Advanced · Course · 1-3 Months,Social Economic Networks Models Analysis
242,242,https://www.coursera.org/learn/hablar-bien-en-publico,Free,Universitat Autònoma de Barcelona,Cómo hablar bien en público,Communication,4.8,(1.9k reviews),Beginner · Course · 1-3 Months,Cmo hablar bien en pblico
243,243,https://www.coursera.org/learn/ai-business-future-of-work,Free,Lund University,"AI, Business & the Future of Work","Machine Learning, Applied Machine Learning, Theoretical Computer Science, Algorithms, Human Computer Interaction, Probability & Statistics, Statistical Tests, Mathematics",4.6,(76 reviews),Beginner · Course · 1-4 Weeks,AI Business  Future Work
244,244,https://www.coursera.org/learn/planetary-health-for-nurses-ysn,Free,Yale University,Planetary Health for Nurses,,,,Intermediate · Course · 1-3 Months,Planetary Health Nurses
245,245,https://www.coursera.org/learn/ancient-marine-reptiles,Free,University of Alberta,Paleontology: Ancient Marine Reptiles,,4.9,(1.2k reviews),Mixed · Course · 1-4 Weeks,Paleontology Ancient Marine Reptiles
246,246,https://www.coursera.org/learn/glasscock,Free,Rice University,English and Academic Preparation - Pre-Collegiate,"Communication, Writing",4.6,(171 reviews),Beginner · Course · 1-4 Weeks,English Academic Preparation  PreCollegiate
247,247,https://www.coursera.org/learn/revisao-sistematica,Free,Universidade Estadual de Campinas,Revisão Sistemática e Meta-análise,"Entrepreneurship, General Statistics, Leadership and Management, Planning, Probability & Statistics, Supply Chain and Logistics, Business Analysis, Communication, Process Analysis, Writing, Data Analysis, Statistical Analysis",4.9,(2.6k reviews),Intermediate · Course · 1-3 Months,Reviso Sistemtica e Metaanlise
248,248,https://www.coursera.org/learn/microeconomics-part2,Free,University of Pennsylvania,Microeconomics: When Markets Fail,"Behavioral Economics, Business Psychology, Leadership and Management",4.8,(574 reviews),Mixed · Course · 1-3 Months,Microeconomics Markets Fail
249,249,https://www.coursera.org/learn/transmedia-storytelling,Free,UNSW Sydney (The University of New South Wales),"Transmedia Storytelling: Narrative worlds, emerging technologies, and global audiences","Communication, Computer Graphics, Creativity, Entrepreneurship, Human Computer Interaction, Interactive Design, Leadership and Management, Marketing, Research and Design, Sales, Storytelling, Strategy, Strategy and Operations, Writing",4.7,(766 reviews),Mixed · Course · 1-3 Months,Transmedia Storytelling Narrative worlds emerging technologies global audiences
250,250,https://www.coursera.org/learn/cuidado-heridas,Free,Universidad Nacional Autónoma de México,Cuidado de heridas en el ámbito hospitalario,,4.8,(1.9k reviews),Intermediate · Course · 1-4 Weeks,Cuidado de heridas en el mbito hospitalario
251,251,https://www.coursera.org/learn/internetgiants,Free,The University of Chicago,Internet Giants: The Law and Economics of Media Platforms,"Computer Graphics, Entrepreneurship, Leadership and Management, Marketing, Sales, Strategy, Strategy and Operations, Human Computer Interaction, Behavioral Economics, Business Psychology, Computer Networking, Finance, Regulations and Compliance, Virtual Reality",4.8,(1k reviews),Mixed · Course · 1-3 Months,Internet Giants Law Economics Media Platforms
252,252,https://www.coursera.org/learn/roman-architecture,Free,Yale University,Roman Architecture,"Business Psychology, Culture, Leadership and Management, Data Architecture, Data Management",4.9,(571 reviews),Beginner · Course · 3-6 Months,Roman Architecture
253,253,https://www.coursera.org/learn/solid-waste-management,Free,École Polytechnique Fédérale de Lausanne,Municipal Solid Waste Management in Developing Countries,"Leadership and Management, Entrepreneurship, Sales, Account Management, Accounting, Audit, Innovation, Marketing, Planning, Research and Design, Strategy, Strategy and Operations",4.8,(3.2k reviews),Intermediate · Course · 1-3 Months,Municipal Solid Waste Management Developing Countries
254,254,https://www.coursera.org/learn/global-marketing-building-iconic-brands,Free,University of Illinois at Urbana-Champaign,Global Marketing: Building Iconic Brands,"Marketing, Brand Management, Communication, Entrepreneurship, Market Research, Research and Design, Advertising, Business Psychology, Culture, Leadership and Management, Marketing Management",4.8,(37 reviews),Mixed · Course · 1-3 Months,Global Marketing Building Iconic Brands
255,255,https://www.coursera.org/learn/basic-chemistry,Free,Duke University,Introduction to Chemistry:  Structures and Solutions,"Entrepreneurship, Leadership and Management, Problem Solving, Research and Design, Mathematics, Business Analysis, Critical Thinking, Strategy and Operations",4.7,(461 reviews),Beginner · Course · 1-3 Months,Introduction Chemistry Structures Solutions
256,256,https://www.coursera.org/learn/big-history,Free,Macquarie University,Big History: Connecting Knowledge,"Business Analysis, Business Psychology, Critical Thinking, Entrepreneurship, Human Learning, Strategy and Operations",4.8,(1.7k reviews),Mixed · Course · 1-3 Months,Big History Connecting Knowledge
257,257,https://www.coursera.org/learn/script-writing,Free,Michigan State University,Script Writing: Write a Pilot Episode for a TV or Web Series (Project-Centered Course),"Communication, Creativity, Entrepreneurship, Research and Design, Writing",4.5,(694 reviews),Mixed · Course · 1-3 Months,Script Writing Write Pilot Episode TV Web Series ProjectCentered Course
258,258,https://www.coursera.org/learn/power-and-foreign-policy-in-international-relations,Free,O.P. Jindal Global University,Power and Foreign Policy in International Relations,,,,Beginner · Course · 1-3 Months,Power Foreign Policy International Relations
259,259,https://www.coursera.org/learn/western-christianity-200-1650,Free,Yale University,A Journey through Western Christianity: from Persecuted Faith to Global Religion (200 - 1650),"Business Psychology, Culture, Leadership and Management, Business Analysis, Critical Thinking, Research and Design, Strategy and Operations",4.8,(580 reviews),Beginner · Course · 1-3 Months,Journey Western Christianity Persecuted Faith Global Religion 200  1650
260,260,https://www.coursera.org/learn/history-of-medicine,Free,"University of California, Santa Cruz","The History of Medicine: Philosophy, Science, and Psychology",,,,Beginner · Course · 1-3 Months,History Medicine Philosophy Science Psychology
261,261,https://www.coursera.org/learn/diabetes-essential-facts,Free,University of Copenhagen,Diabetes – the Essential Facts,,4.7,(2k reviews),Beginner · Course · 1-4 Weeks,Diabetes  Essential Facts
262,262,https://www.coursera.org/learn/artinquiry,Free,The Museum of Modern Art,Art & Inquiry: Museum Teaching Strategies For Your Classroom,"Business Analysis, Critical Thinking, Research and Design, Strategy and Operations, Business Psychology, Entrepreneurship, Human Learning, Human Resources, Leadership and Management, People Development",4.7,(431 reviews),Mixed · Course · 1-4 Weeks,Art  Inquiry Museum Teaching Strategies Classroom
263,263,https://www.coursera.org/learn/empresas-familiares,Free,Universidad Nacional Autónoma de México,Empresas familiares,"Project Management, Strategy and Operations",,,Beginner · Course · 1-4 Weeks,Empresas familiares
264,264,https://www.coursera.org/learn/mindshift,Free,McMaster University,Mindshift: Break Through Obstacles to Learning and Discover Your Hidden Potential,"Business Psychology, Entrepreneurship, Human Learning, Communication, Emotional Intelligence, Leadership and Management",4.8,(12.3k reviews),Beginner · Course · 1-4 Weeks,Mindshift Break Obstacles Learning Discover Hidden Potential
265,265,https://www.coursera.org/learn/corrosion,Free,University of Manchester,Protecting the World: Introducing Corrosion Science and Engineering,"Material Handling, Feature Engineering, Graph Theory, Machine Learning, Mathematics, Entrepreneurship, Market Research, Research and Design, Big Data, Data Management, Data Visualization, Scientific Visualization",4.6,(766 reviews),Intermediate · Course · 1-4 Weeks,Protecting World Introducing Corrosion Science Engineering
266,266,https://www.coursera.org/learn/sports-society,Free,Duke University,Sports and Society,"Business Psychology, Culture, Leadership and Management, Game Theory, Mathematics",4.8,(1.1k reviews),Mixed · Course · 1-3 Months,Sports Society
267,267,https://www.coursera.org/learn/norms,Free,University of Pennsylvania,"Social Norms, Social Change I","Design and Product, Entrepreneurship, Human Computer Interaction, Market Research, Research and Design, User Research",4.6,(2k reviews),Beginner · Course · 1-4 Weeks,Social Norms Social Change
268,268,https://www.coursera.org/learn/practical-time-series-analysis,Free,The State University of New York,Practical Time Series Analysis,"General Statistics, Probability & Statistics, Forecasting, Statistical Programming, Computer Programming, R Programming, Data Analysis, Algorithms, Correlation And Dependence, Data Visualization, Machine Learning, Mathematics, Plot (Graphics), Programming Principles, Statistical Analysis, Statistical Machine Learning, Statistical Tests, Theoretical Computer Science, Basic Descriptive Statistics, Bayesian Statistics, Data Analysis Software, Data Mining, Estimation, Experiment, Exploratory Data Analysis, Probability Distribution, Regression",4.6,(1.6k reviews),Intermediate · Course · 1-3 Months,Practical Time Series Analysis
269,269,https://www.coursera.org/learn/astrobiology-exploring-other-worlds,Free,University of Arizona,Astrobiology: Exploring Other Worlds,"Communication, Epidemiology, Mathematics, Probability & Statistics",4.9,(408 reviews),Beginner · Course · 1-3 Months,Astrobiology Exploring Worlds
270,270,https://www.coursera.org/learn/researcher-management-leadership-training,Free,University of Colorado System,Researcher Management and Leadership Training,"Leadership and Management, Human Resources, Strategy and Operations, Leadership Development, Entrepreneurship, People Management, Budget Management, Finance, Financial Management, Performance Management, Professional Development, Recruitment",4.9,(288 reviews),Intermediate · Course · 1-3 Months,Researcher Management Leadership Training
271,271,https://www.coursera.org/learn/climate-change-mitigation,Free,University of Cape Town,Climate Change Mitigation in Developing Countries,"Entrepreneurship, Leadership and Management, Marketing, Problem Solving, Research and Design, Sales, Strategy, Strategy and Operations",4.7,(490 reviews),Intermediate · Course · 1-3 Months,Climate Change Mitigation Developing Countries
272,272,https://www.coursera.org/learn/smart-cities,Free,École Polytechnique Fédérale de Lausanne,Smart Cities – Management of Smart Urban Infrastructures,"Computer Architecture, Computer Graphics, Computer Networking, Human Computer Interaction, Interactive Design, Supply Chain and Logistics, Entrepreneurship, Business Analysis, Data Visualization, Data Visualization Software, Leadership and Management, Marketing, Operations Management, Packaging and Labeling, Store Management, Strategy and Operations, Transportation Operations Management",4.7,(1.6k reviews),Beginner · Course · 1-3 Months,Smart Cities  Management Smart Urban Infrastructures
273,273,https://www.coursera.org/learn/advanced-neurobiology1,Free,Peking University,Advanced Neurobiology I,"Accounting, Communication, Entrepreneurship, Probability & Statistics, Business Analysis, Data Analysis, Data Management, Market Research, Marketing, Mathematics, Research and Design, Algebra, Biostatistics, Business Communication, Business Psychology, Experiment, Human Resources, Market Analysis, Accounting Software, Applied Mathematics, Behavioral Economics, Benefits, Big Data, Bioinformatics, Business Process Management, Calculus, Clinical Data Management, Computer Architecture, Corporate Accouting, Data Analysis Software, Financial Analysis, General Accounting, Hardware Design, Human Learning, Marketing Management, Spreadsheet Software, Statistical Analysis, Strategy and Operations, Training, Writing",4.1,(537 reviews),Intermediate · Course · 1-3 Months,Advanced Neurobiology
274,274,https://www.coursera.org/learn/agriculture-economics-nature,Free,University of Western Australia,"Agriculture, Economics and Nature","Leadership and Management, Accounting, Business Psychology, Entrepreneurship, Organizational Development, Strategy and Operations, Adaptability, Behavioral Economics, Data Visualization, Econometrics, Operations Management, Probability & Statistics, Problem Solving, Research and Design, Scientific Visualization",4.7,(380 reviews),Beginner · Course · 1-3 Months,Agriculture Economics Nature
275,275,https://www.coursera.org/learn/horse-care,Free,University of Florida,The Horse Course: Introduction to Basic Care and Management,Leadership and Management,4.9,(875 reviews),Mixed · Course · 1-3 Months,Horse Course Introduction Basic Care Management
276,276,https://www.coursera.org/learn/gestionar-personas,Free,IESE Business School,Claves para Gestionar Personas,"Entrepreneurship, Human Resources, Sales, Leadership and Management, Strategy and Operations, Budget Management, Finance, Recruitment",4.8,(2.1k reviews),Mixed · Course · 1-3 Months,Claves para Gestionar Personas
277,277,https://www.coursera.org/learn/gestionempresarialpyme,Free,Pontificia Universidad Católica de Chile,Gestión Empresarial Exitosa para Pymes,"Entrepreneurship, Leadership and Management, Marketing, Sales, Strategy, Strategy and Operations, Accounting, Business Analysis, Data Analysis, Finance, Financial Analysis, Human Resources",4.8,(5k reviews),Mixed · Course · 1-3 Months,Gestin Empresarial Exitosa para Pymes
278,278,https://www.coursera.org/learn/big-bang,Free,The University of Tokyo,From the Big Bang to Dark Energy,"Mathematics, Entrepreneurship, Leadership and Management, Problem Solving",4.8,(3.3k reviews),Beginner · Course · 1-4 Weeks,Big Bang Dark Energy
279,279,https://www.coursera.org/learn/disability-inclusion-education,Free,University of Cape Town,Disability Inclusion in Education: Building Systems of Support,"Business Psychology, Collaboration, Communication, Entrepreneurship, Human Learning, Human Resources, Leadership and Management, People Development, Writing",4.8,(317 reviews),Beginner · Course · 1-3 Months,Disability Inclusion Education Building Systems Support
